{
  "$schema": "https://rmside.invalid/schemas/rms-documentation-catalog/v1",
  "schemaVersion": "1.1.0",
  "compatibility": {
    "minimumMajor": 1,
    "maximumMajor": 1
  },
  "catalogId": "aoe2de-rms-documentation-v1",
  "profiles": [
    "aoe2de-101.103.48987-rms-v1",
    "aoe2de-101.103.54800-rms-v1",
    "aoe2de-101.103.57257-rms-v1"
  ],
  "sources": [
    {
      "id": "strict-parser",
      "title": "RMSIDE strict parser and command table",
      "role": "primary"
    },
    {
      "id": "exact-engine",
      "title": "RMSIDE exact generation engine",
      "role": "primary"
    },
    {
      "id": "setup-context",
      "title": "RMSIDE setup context and its run-setting labels",
      "role": "primary"
    },
    {
      "id": "support-bundles",
      "title": "Packaged support bundles: the built-in names and values of each shipped profile",
      "role": "primary"
    },
    {
      "id": "community-guide",
      "title": "Community random map scripting documentation, chiefly Zetnus' Definitive Random Map Scripting Guide; research evidence only, no text reproduced",
      "role": "research"
    }
  ],
  "terms": [
    {
      "name": "<PLAYER_SETUP>",
      "kind": "section",
      "summary": "Starts the section that decides how players are placed on the map.",
      "details": [
        "It holds `random_placement`, `grouped_by_team`, `direct_placement`, `nomad_resources`, and `force_nomad_treaty`; those commands have no effect in any other section.",
        "Sections may appear in any order and more than once; a header only decides where the commands after it belong. The game always generates player setup, lands, elevation, cliffs, terrains, connections, and objects in that order, whatever the order in the script."
      ],
      "example": ["<PLAYER_SETUP>", "random_placement"],
      "related": ["<LAND_GENERATION>", "random_placement", "direct_placement"],
      "evidence": {
        "status": "engine-verified",
        "sources": ["exact-engine", "strict-parser"]
      }
    },
    {
      "name": "<LAND_GENERATION>",
      "kind": "section",
      "summary": "Starts the section that lays the base terrain and grows the lands: one for each player and any number of neutral ones.",
      "details": [
        "Outside blocks it takes `base_terrain` and `base_layer`; `create_player_lands` and `create_land` open the blocks that describe each land. The lands paint their starting squares in script order and then grow together, one tile per land at a time, until each reaches its size.",
        "Sections may appear in any order and more than once; a header only decides where the commands after it belong. The game always generates player setup, lands, elevation, cliffs, terrains, connections, and objects in that order, whatever the order in the script."
      ],
      "example": [
        "<LAND_GENERATION>",
        "base_terrain WATER",
        "create_player_lands",
        "{",
        "    terrain_type GRASS",
        "    land_percent 70",
        "}"
      ],
      "related": ["create_player_lands", "create_land", "base_terrain"],
      "evidence": {
        "status": "engine-verified",
        "sources": ["exact-engine", "strict-parser"]
      }
    },
    {
      "name": "<ELEVATION_GENERATION>",
      "kind": "section",
      "summary": "Starts the section that raises hills with `create_elevation`.",
      "details": [
        "Elevation runs after the lands and before cliffs and terrains, so its `base_terrain` filters see the terrain the lands left. Whether or not the section exists, the heights are smoothed afterwards so that neighbouring tiles differ by at most one level.",
        "Sections may appear in any order and more than once; a header only decides where the commands after it belong. The game always generates player setup, lands, elevation, cliffs, terrains, connections, and objects in that order, whatever the order in the script."
      ],
      "related": ["create_elevation", "<CLIFF_GENERATION>"],
      "evidence": {
        "status": "engine-verified",
        "sources": ["exact-engine", "strict-parser"]
      }
    },
    {
      "name": "<CLIFF_GENERATION>",
      "kind": "section",
      "summary": "Starts the section that draws cliffs; its commands set their number, length, shape, and spacing.",
      "details": [
        "Cliffs are only made when the section holds at least one command: a header alone makes none, while any one setting, even at its default value, is enough. The commands are read outside blocks only; anything inside braces is ignored. Cliffs keep clear of every land origin and of water.",
        "Sections may appear in any order and more than once; a header only decides where the commands after it belong. The game always generates player setup, lands, elevation, cliffs, terrains, connections, and objects in that order, whatever the order in the script."
      ],
      "example": [
        "<CLIFF_GENERATION>",
        "min_number_of_cliffs 2",
        "max_number_of_cliffs 5",
        "cliff_curliness 20"
      ],
      "related": ["cliff_type", "min_number_of_cliffs", "min_length_of_cliff"],
      "evidence": {
        "status": "engine-verified",
        "sources": ["exact-engine", "strict-parser"],
        "note": "An empty section makes no cliffs in our engine; a community guide says a bare header makes default cliffs."
      }
    },
    {
      "name": "<TERRAIN_GENERATION>",
      "kind": "section",
      "summary": "Starts the section that paints terrains in clumps with `create_terrain`.",
      "details": [
        "Each `create_terrain` paints in script order on top of what the lands, cliffs, and earlier terrains left, so a later terrain can use an earlier one as its `base_terrain`.",
        "Sections may appear in any order and more than once; a header only decides where the commands after it belong. The game always generates player setup, lands, elevation, cliffs, terrains, connections, and objects in that order, whatever the order in the script."
      ],
      "related": ["create_terrain", "<CONNECTION_GENERATION>"],
      "evidence": {
        "status": "engine-verified",
        "sources": ["exact-engine", "strict-parser"]
      }
    },
    {
      "name": "<CONNECTION_GENERATION>",
      "kind": "section",
      "summary": "Starts the section that paints paths between lands, for example roads or shallows across water.",
      "details": [
        "Each `create_connect_…` command chooses which lands to join; its block sets what paths cost to cross each terrain and what they paint. After the connections, land next to water gets its shore terrain.",
        "Sections may appear in any order and more than once; a header only decides where the commands after it belong. The game always generates player setup, lands, elevation, cliffs, terrains, connections, and objects in that order, whatever the order in the script."
      ],
      "related": ["create_connect_all_players_land", "accumulate_connections", "terrain_cost"],
      "evidence": {
        "status": "engine-verified",
        "sources": ["exact-engine", "strict-parser"]
      }
    },
    {
      "name": "<OBJECTS_GENERATION>",
      "kind": "section",
      "summary": "Starts the section that places objects: units, buildings, resources, and decorations.",
      "details": [
        "Objects are placed in script order, and each placement takes up space that later commands cannot use. `create_object` places one kind of object, `create_object_group` names a weighted set of kinds, and `create_actor_area` marks an area for later rules.",
        "Sections may appear in any order and more than once; a header only decides where the commands after it belong. The game always generates player setup, lands, elevation, cliffs, terrains, connections, and objects in that order, whatever the order in the script."
      ],
      "related": ["create_object", "create_object_group", "create_actor_area"],
      "evidence": {
        "status": "engine-verified",
        "sources": ["exact-engine", "strict-parser"]
      }
    },
    {
      "name": "#define",
      "kind": "directive",
      "summary": "Defines a label, so that `if` with that label holds.",
      "parameters": [
        {
          "name": "name",
          "kind": "name",
          "description": "The label to define."
        }
      ],
      "details": [
        "Used as a number the label stands for 0; `if` only asks whether it is defined. The first definition of a name wins: a later `#define` or `#const` of the same name is ignored, and so is a name the game already defines. Inside a branch that does not run, nothing is defined."
      ],
      "example": [
        "#define ISLAND_START",
        "if ISLAND_START",
        "    #const START_TERRAIN WATER",
        "endif"
      ],
      "related": ["#const", "if", "#undefine"],
      "evidence": {
        "status": "engine-verified",
        "sources": ["strict-parser"]
      }
    },
    {
      "name": "#undefine",
      "kind": "directive",
      "summary": "Accepted, but the name stays defined afterwards: it does not turn a label off.",
      "parameters": [
        {
          "name": "name",
          "kind": "label",
          "description": "The label it names."
        }
      ],
      "details": [
        "Do not rely on it to switch a label off later in the script; choose labels with `if` and `else` instead."
      ],
      "related": ["#define", "#const"],
      "evidence": {
        "status": "uncertain",
        "sources": ["strict-parser", "community-guide"],
        "note": "Our strict parser treats it as inert (parser test); community documentation says it removes the name. Not checked against the game."
      }
    },
    {
      "name": "#const",
      "kind": "directive",
      "summary": "Defines a named number.",
      "parameters": [
        {
          "name": "name",
          "kind": "name",
          "description": "The name to define."
        },